{
  "schemaVersion": "0.2",
  "description": "profile description",
  "rules": [
    {
      "rule": "rule 1",
      "constraints": [
        {
          "allOf": [
            {
              "field": "field1",
              "is": "ofType",
              "value": "string"
            },
            {
              "field": "field2",
              "is": "greaterThan",
              "value": 43
            }
          ]
        }
      ]
    }
  ],
  "fields": [
    {
      "name": "field1"
    }
  ]
}